{
  "schema_version": "awesome-capture.artifact/v2",
  "artifact_type": "transcript",
  "status": "complete",
  "created_at": "2026-07-27T00:00:00Z",
  "source": {
    "path": "/input/source.mp4",
    "snapshot_path": "/private/stage/source.mp4",
    "sha256": "aaaaaaaaaaaaaaaaaaaaaaaaaaaaaaaaaaaaaaaaaaaaaaaaaaaaaaaaaaaaaaaa",
    "bytes": 2048,
    "duration_ms": 2000,
    "has_audio": true,
    "has_video": true,
    "upstream": null,
    "sidecar": {
      "path": "/private/stage/source.srt",
      "sha256": "aaaaaaaaaaaaaaaaaaaaaaaaaaaaaaaaaaaaaaaaaaaaaaaaaaaaaaaaaaaaaaaa",
      "bytes": 10
    }
  },
  "transcription": {
    "job_id": "a98234ccb4ae276079124a2c2f9c3b952a5dfba4767c49ad5f7797c88b892488",
    "settings_sha256": "47b6e5166baea42b90342f009a84f1f6ef5508c5596a52b504bf070c51b2e3f4",
    "algorithm": {
      "version": "awesome-capture.transcription-algorithm/v1",
      "sha256": "dddddddddddddddddddddddddddddddddddddddddddddddddddddddddddddddd"
    },
    "execution_guard_sha256": "ffffffffffffffffffffffffffffffffffffffffffffffffffffffffffffffff",
    "engine": "sidecar-subtitle",
    "engine_identity": {
      "identity_sha256": "bbe16f576ef1bc3abb90978bd36cbd63113ecb6acd3b7df379e9bdddeb0fca08",
      "model": null,
      "executable": null,
      "adapter": {
        "kind": "file",
        "path": "/private/stage/source.srt",
        "sha256": "aaaaaaaaaaaaaaaaaaaaaaaaaaaaaaaaaaaaaaaaaaaaaaaaaaaaaaaaaaaaaaaa",
        "bytes": 10,
        "version": null
      },
      "packages": []
    },
    "requested_language": "zh",
    "detected_language": "zh",
    "chunk_seconds": 600,
    "whisper_cpp_cpu_only": false,
    "chunk_set": null,
    "devices_used": [],
    "gpu_fallback_count": 0
  },
  "segments": [
    {
      "start_ms": 100,
      "end_ms": 1000,
      "text": "你好",
      "chunk_index": 0
    }
  ],
  "text": "你好",
  "no_speech_detected": false,
  "outputs": {
    "markdown": {
      "path": "/private/stage/transcript.md",
      "bytes": 6,
      "sha256": "cccccccccccccccccccccccccccccccccccccccccccccccccccccccccccccccc"
    },
    "text": {
      "path": "/private/stage/transcript.txt",
      "bytes": 6,
      "sha256": "cccccccccccccccccccccccccccccccccccccccccccccccccccccccccccccccc"
    },
    "srt": {
      "path": "/private/stage/transcript.srt",
      "bytes": 32,
      "sha256": "dddddddddddddddddddddddddddddddddddddddddddddddddddddddddddddddd"
    },
    "vtt": {
      "path": "/private/stage/transcript.vtt",
      "bytes": 32,
      "sha256": "dddddddddddddddddddddddddddddddddddddddddddddddddddddddddddddddd"
    },
    "state": {
      "path": "/private/stage/state.json",
      "bytes": 128,
      "sha256": "eeeeeeeeeeeeeeeeeeeeeeeeeeeeeeeeeeeeeeeeeeeeeeeeeeeeeeeeeeeeeeee"
    },
    "chunk_manifest": null
  },
  "warnings": [],
  "producer": {
    "skill": "transcribe-media",
    "contract_digest": "647ca3a9d65d2b11af4e6a4cbe65eabf7f40c778616de84f2ef07b5ce1359001"
  }
}
